{
  "$schema": "./result.schema.json",
  "schema_version": 1,
  "run": {
    "id": "20260715T170818Z-bonsai-27b-q1_0-alman-32k",
    "started_at": "2026-07-15T17:10:32+00:00",
    "completed_at": "2026-07-15T18:23:57+00:00",
    "status": "success"
  },
  "benchmark": {
    "task": "alman_bench",
    "dataset": "curated",
    "raw_sample_count": 87,
    "sample_count": 87,
    "excluded_spec_example_count": 0,
    "excluded_spec_example_ids": [],
    "spec_in_context": true,
    "spec_examples_in_dataset": false,
    "commit": "f65b439",
    "working_tree_dirty": false,
    "working_tree_changes": []
  },
  "model": {
    "repository": "prism-ml/Bonsai-27B-gguf",
    "revision": "0cf7e3d21581b169b4df1de8bf01316000e2fbb7",
    "served_name": "bonsai-27b-1bit",
    "quantization": "Q1_0_g128 binary 1-bit",
    "thinking": {
      "enabled": true,
      "verification_method": "nonempty reasoning_content or think block",
      "verified_sample_count": 87
    }
  },
  "endpoint": {
    "provider": "inspect-openai-api",
    "api": "chat_completions",
    "base_url": "http://127.0.0.1:8001/v1",
    "max_connections": 4,
    "max_samples": 4
  },
  "runtime": {
    "engine": "llama.cpp",
    "version": "62061f9",
    "executable": "/home/onur/runtimes/llama-cpp/versions/llama-cpp-prism-62061f9-sm121/build/bin/llama-server",
    "manifest": "/home/onur/runtimes/llama-cpp/versions/llama-cpp-prism-62061f9-sm121/manifest.json",
    "recipe": {
      "repository": "https://github.com/PrismML-Eng/llama.cpp.git",
      "commit": "62061f91088281e65071cc38c5f69ee95c39f14e",
      "path": "tools/server/README.md",
      "profile": "alman-32k-serial",
      "deviations": [
        "increase context from the initial 16k smoke profile to 32k for the benchmark prompt plus an 8k generation ceiling",
        "use four 32k server slots and up to four benchmark samples at a time",
        "leave the KV cache at the llama.cpp f16 default",
        "omit the optional DSpark drafter so both Bonsai variants use ordinary target-model decoding"
      ]
    },
    "server": {
      "arguments": [
        "/home/onur/runtimes/llama-cpp/versions/llama-cpp-prism-62061f9-sm121/build/bin/llama-server",
        "-m",
        "/srv/huggingface/hub/models--prism-ml--Bonsai-27B-gguf/snapshots/0cf7e3d21581b169b4df1de8bf01316000e2fbb7/Bonsai-27B-Q1_0.gguf",
        "--host",
        "127.0.0.1",
        "--port",
        "8001",
        "--alias",
        "bonsai-27b-1bit",
        "--ctx-size",
        "131072",
        "--parallel",
        "4",
        "--gpu-layers",
        "999",
        "--reasoning",
        "auto",
        "--reasoning-budget",
        "4096",
        "--cache-type-k",
        "f16",
        "--cache-type-v",
        "f16",
        "--cache-prompt",
        "--jinja",
        "--metrics"
      ],
      "max_model_len": 32768,
      "max_num_seqs": 4,
      "max_num_batched_tokens": 131072,
      "kv_cache_dtype": "f16",
      "attention_backend": "PrismML CUDA hybrid-attention",
      "moe_backend": "none",
      "prefix_caching": true
    }
  },
  "generation": {
    "max_tokens": 8192,
    "reasoning_token_budget": 4096,
    "sampling_source": "PrismML recommended thinking-mode settings",
    "do_sample": true,
    "temperature": 0.7,
    "top_p": 0.95,
    "top_k": 20,
    "presence_penalty": 0.0
  },
  "hardware": {
    "accelerator": "NVIDIA GB10",
    "unified_memory_gib": 121.0
  },
  "memory_guard": {
    "process_guard": "/home/onur/.codex/skills/safe-inference-launch/scripts/guarded-launch.sh",
    "earlyoom": true,
    "memory_available_floor_gib": 24.0,
    "swap_free_floor_gib": 4.0,
    "pressure_kill_occurred": false
  },
  "results": {
    "duration_seconds": 4405.0,
    "acceptance": {
      "correct": 28,
      "total": 87,
      "rate": 0.3218390804597701,
      "stderr": 0.05008712945797549
    },
    "compliance": {
      "correct": 71,
      "total": 87,
      "rate": 0.8160919540229885,
      "stderr": 0.0415346243321518
    },
    "groups": {
      "ablaut": {
        "correct": 1,
        "total": 2,
        "rate": 0.5,
        "stderr": 0.3535533905932738
      },
      "berufe": {
        "correct": 3,
        "total": 5,
        "rate": 0.6,
        "stderr": 0.21908902300206645
      },
      "deutsch-alman": {
        "correct": 5,
        "total": 11,
        "rate": 0.45454545454545453,
        "stderr": 0.150131422517231
      },
      "die-verwandlung": {
        "correct": 0,
        "total": 4,
        "rate": 0.0,
        "stderr": 0.0
      },
      "regelabdeckung": {
        "correct": 13,
        "total": 26,
        "rate": 0.5,
        "stderr": 0.09805806756909202
      },
      "relativsaetze": {
        "correct": 4,
        "total": 13,
        "rate": 0.3076923076923077,
        "stderr": 0.1280077375904375
      },
      "siddhartha": {
        "correct": 0,
        "total": 16,
        "rate": 0.0,
        "stderr": 0.0
      },
      "starke-flexion": {
        "correct": 2,
        "total": 8,
        "rate": 0.25,
        "stderr": 0.15309310892394862
      },
      "steppenwolf": {
        "correct": 0,
        "total": 2,
        "rate": 0.0,
        "stderr": 0.0
      }
    },
    "tokens": {
      "input": 44020,
      "cached_input": 1158864,
      "output": 267447,
      "reasoning": null,
      "total": 1470331
    },
    "samples_with_reasoning": 87
  },
  "artifacts": {
    "inspect_log": "/home/onur/scratch/alman-benchmark-runs/incremental-87/bonsai/20260715T170818Z-bonsai-27b-q1_0-alman-32k/inspect/2026-07-15T17-10-32-00-00_alman-bench_HQgxDuYbueabTgETx6mDaW.eval",
    "server_log": "/home/onur/scratch/alman-benchmark-runs/incremental-87/bonsai/20260715T170818Z-bonsai-27b-q1_0-alman-32k/server.log",
    "smoke_response": "/home/onur/scratch/alman-benchmark-runs/incremental-87/bonsai/20260715T170818Z-bonsai-27b-q1_0-alman-32k/smoke-response.json"
  }
}
